{
  "report_version": "1.0",
  "input": {
    "type": "screenshot",
    "screenshots": [
      {
        "ref": "sample_dashboard",
        "role": "current_state",
        "order": 1
      }
    ],
    "scenario": "运营看板",
    "task_goal": "发现异常订单并采取处理动作",
    "task_context": {
      "user": "运营管理员",
      "task": "发现异常订单并采取处理动作",
      "interface_capabilities": [
        "查看异常订单",
        "导出表格",
        "处理异常订单"
      ],
      "expected_result": "异常订单被识别并进入处理流程"
    }
  },
  "dsl": {
    "pages": [
      {
        "page_id": "p1",
        "page_name": "运营看板",
        "page_type": "dashboard",
        "business_scenario": "监控运营异常",
        "user_goal": "识别并处理异常订单",
        "task_context": {
          "user": "运营管理员",
          "task": "发现异常订单并采取处理动作",
          "interface_capabilities": [
            "查看异常订单",
            "导出表格",
            "处理异常订单"
          ],
          "expected_result": "异常订单被识别并进入处理流程"
        },
        "generation": {
          "method": "auto_from_screenshot_and_prompt",
          "evidence_sources": [
            "sample_dashboard"
          ],
          "context_fields_used": [
            "user",
            "task",
            "interface_capabilities",
            "expected_result"
          ],
          "context_only_claims": [
            "处理异常订单"
          ],
          "conflicts": [
            "提示词包含处理异常订单能力，但截图中没有可见的行级处理入口。"
          ]
        },
        "source": {
          "mode": "screenshot",
          "dom_ref": null,
          "accessibility_ref": null,
          "runtime_ref": null,
          "screenshot_ref": "sample_dashboard",
          "device_class": "desktop",
          "viewport": {
            "width": null,
            "height": null
          },
          "quality": [
            "clear"
          ],
          "order": 1
        },
        "screenshot": {
          "screenshot_ref": "sample_dashboard",
          "device_class": "desktop",
          "viewport": {
            "width": null,
            "height": null
          },
          "quality": [
            "clear"
          ],
          "order": 1
        },
        "regions": [
          {
            "id": "r_main",
            "name": "主看板",
            "role": "main",
            "bbox": [
              0.18,
              0.12,
              0.76,
              0.8
            ],
            "children": [
              "tbl_orders",
              "btn_export"
            ]
          }
        ],
        "components": [
          {
            "id": "tbl_orders",
            "type": "table",
            "label": "订单异常",
            "state": "default",
            "visibility": "visible",
            "bbox": [
              0.2,
              0.28,
              0.72,
              0.52
            ],
            "actions": [
              "review_order"
            ],
            "text": [
              "订单 ID",
              "状态",
              "负责人"
            ],
            "evidence": "sample_dashboard:r_main:tbl_orders"
          },
          {
            "id": "btn_export",
            "type": "button",
            "label": "导出",
            "state": "default",
            "visibility": "visible",
            "bbox": [
              0.78,
              0.18,
              0.12,
              0.05
            ],
            "actions": [
              "export_table"
            ],
            "text": [
              "导出"
            ],
            "evidence": "sample_dashboard:r_main:btn_export"
          }
        ],
        "forms": [],
        "navigation": [
          {
            "id": "nav_dashboard",
            "type": "menu",
            "label": "看板",
            "target": "unknown",
            "state": "selected"
          }
        ],
        "feedback_elements": [],
        "visual_priority": [
          {
            "rank": 1,
            "component_ref": "tbl_orders",
            "reason": "中央表格占据可见屏幕的主要区域"
          }
        ],
        "accessibility_notes": [
          {
            "type": "text_size",
            "evidence": "sample_dashboard:r_main:tbl_orders",
            "certainty": "medium"
          }
        ],
        "uncertain": [
          "截图中没有可见的行级恢复操作。"
        ]
      }
    ],
    "flow": null,
    "interactions": [],
    "uncertain": [
      "精确的订单审核流程在截图中不可见。"
    ]
  },
  "ucats": {
    "clarity_score": 77,
    "overall_score": null,
    "gate": "review",
    "walkthrough": {
      "information_presentation": {
        "weight": 0.35,
        "score": 84,
        "status": "applicable",
        "involved_elements": [
          "info_findable",
          "info_value_understandable",
          "info_text_understandable",
          "info_scannable"
        ],
        "evidence": [
          "dsl.pages[0].regions[0]",
          "dsl.pages[0].navigation[0]",
          "dsl.pages[0].visual_priority[0]"
        ],
        "elements": [
          {
            "id": "info_findable",
            "status": "applicable",
            "weight": 0.25,
            "score": 90,
            "evidence": [
              "dsl.pages[0].regions[0]",
              "dsl.pages[0].components[0]"
            ],
            "deductions": [
              {
                "issue_id": "iss_1",
                "criterion_id": "E1-03",
                "unit_scope": "region:r_main/component:tbl_orders",
                "state_scope": "default",
                "expected": "主任务对象附近应有可见处理入口或可见连接关系。",
                "actual": "异常订单表格可见，但截图中没有行级处理入口或邻近处理动作。",
                "evidence_test": "任务对象 tbl_orders 与处理动作不在同一区域，且没有可见操作列、按钮或链接。",
                "problem_count": 10,
                "scale_level": 1,
                "points_per_problem": 1,
                "points": 10,
                "reason": "异常表格可见，但处理入口不在异常对象附近，降低任务相关信息可发现性。",
                "evidence": [
                  "dsl.pages[0].components[0]",
                  "dsl.pages[0].uncertain[0]"
                ]
              }
            ]
          },
          {
            "id": "info_value_understandable",
            "status": "applicable",
            "weight": 0.25,
            "score": 85,
            "evidence": [
              "dsl.pages[0].page_type",
              "dsl.pages[0].components[0]",
              "dsl.pages[0].uncertain[0]"
            ],
            "deductions": [
              {
                "issue_id": "iss_2",
                "criterion_id": "E2-02",
                "unit_scope": "region:r_main/component:tbl_orders",
                "state_scope": "default",
                "expected": "界面应说明处理异常订单可以得到的结果或下一步。",
                "actual": "截图只展示异常订单表格，没有展示处理结果或处理路径。",
                "evidence_test": "页面能力只来自 task_context，界面证据中没有结果导向说明或处理入口。",
                "problem_count": 15,
                "scale_level": 1,
                "points_per_problem": 1,
                "points": 15,
                "reason": "提示词声明处理异常订单能力，但截图没有展示处理能力如何达成。",
                "evidence": [
                  "dsl.pages[0].components[0]",
                  "dsl.pages[0].uncertain[0]"
                ]
              }
            ]
          },
          {
            "id": "info_text_understandable",
            "status": "applicable",
            "weight": 0.25,
            "score": 82,
            "evidence": [
              "dsl.pages[0].components[0]",
              "dsl.pages[0].navigation[0]"
            ],
            "deductions": [
              {
                "issue_id": "iss_2",
                "criterion_id": "E3-02",
                "unit_scope": "region:r_main/component:tbl_orders",
                "state_scope": "default",
                "expected": "处理相关文案应表达动作对象和结果。",
                "actual": "可见文案能说明看板对象，但没有解释处理动作、处理结果或下一步含义。",
                "evidence_test": "表格和导航文本中缺少动作+对象+结果结构的处理文案。",
                "problem_count": 18,
                "scale_level": 1,
                "points_per_problem": 1,
                "points": 18,
                "reason": "可见文案能说明看板对象，但没有解释处理动作、处理结果或下一步含义。",
                "evidence": [
                  "dsl.pages[0].components[0]",
                  "dsl.pages[0].uncertain[0]"
                ]
              }
            ]
          },
          {
            "id": "info_scannable",
            "status": "applicable",
            "weight": 0.25,
            "score": 79,
            "evidence": [
              "dsl.pages[0].visual_priority[0]",
              "dsl.pages[0].components[0]"
            ],
            "deductions": [
              {
                "issue_id": "iss_3",
                "criterion_id": "E4-02",
                "unit_scope": "component:tbl_orders",
                "state_scope": "default",
                "expected": "异常优先级、处理状态或下一步应在表格中有优先级标记。",
                "actual": "截图没有展示异常优先级、处理状态或行级反馈。",
                "evidence_test": "表格可见字段未包含优先级、处理状态、待处理标记或行级反馈。",
                "problem_count": 21,
                "scale_level": 1,
                "points_per_problem": 1,
                "points": 21,
                "reason": "截图没有展示异常优先级、处理状态或行级反馈，扫读后仍难判断下一步。",
                "evidence": [
                  "dsl.pages[0].components[0]",
                  "dsl.pages[0].feedback_elements"
                ]
              }
            ]
          }
        ]
      },
      "operation_experience": {
        "weight": 0.65,
        "score": 73,
        "status": "evidence_insufficient",
        "involved_elements": [
          "operability",
          "operation_guidance",
          "operation_feedback",
          "smoothness",
          "recovery"
        ],
        "evidence": [
          "dsl.pages[0].components[0]",
          "dsl.pages[0].feedback_elements",
          "dsl.pages[0].uncertain[0]"
        ],
        "elements": [
          {
            "id": "operability",
            "status": "applicable",
            "weight": 0.2,
            "score": 80,
            "evidence": [
              "dsl.pages[0].components[0]",
              "dsl.pages[0].components[1]"
            ],
            "deductions": [